{
  "meta": {
    "title": "人形家用机器人需求诊断报告",
    "product_name": "人形家用机器人",
    "generated_at": "2026-06-12",
    "language": "zh-CN",
    "analyst": "Yao Demand Skill",
    "analysis_goal": "新品类需求验证与商业化优先级判断",
    "target_market": "中国一二线城市中高收入家庭，重点覆盖家务辅助、银发陪护、居家安全和高端智能家居尝鲜人群",
    "source_boundary": "用户输入为品类方向而非具体 SKU。本报告检索截至 2026-06-12 的官方产品页、行业报告、政策与媒体实测/评论；工业、科研和商用人形机器人只作为能力边界、价格区间和替代方案证据，不把其订单直接等同于家庭购买需求。"
  },
  "executive_summary": {
    "one_sentence": "人形家用机器人存在真实愿望和长期趋势，但当下家庭场景的需求成立被价格、能力边界、安全隐私和可获得性明显卡住，更适合先从高端试点、养老陪护和家政服务机构共创验证，而不是面向普通家庭规模化销售。",
    "decision": "reposition",
    "total_score": 4.33,
    "lack_score": 6.65,
    "target_object_score": 5.63,
    "consumer_ability_score": 3.46,
    "evidence_confidence": 0.82,
    "context_adjustment": 0.1,
    "biggest_opportunity": "老龄化、家政服务缺口、智能家居普及和家庭自动化愿望共同形成长期需求土壤；如果能把任务范围收窄到高频、低风险、可验证的家庭任务，需求会明显增强。",
    "biggest_risk": "真实家庭环境开放且不规则，当前通用家务能力、远程操作隐私、物理安全、价格和售后责任都没有达到普通家庭放心购买的门槛。"
  },
  "product_canvas": {
    "definition": "面向家庭环境的具身智能人形机器人，采用双足或类人移动形态，能通过视觉、语音和机械臂在家中完成取物、整理、提醒、陪伴、巡检、简单家务和智能家居控制等任务。",
    "value_proposition": "把家庭中反复出现、耗时、分散且难以标准化的家务和照护任务，转化为可委托、可监督、可逐步学习的实体执行能力。",
    "features": [
      "语音对话、家庭成员识别和场景记忆",
      "取物、递送、开门、简单收纳和桌面整理",
      "洗衣、叠衣、厨房辅助等低速家务试点任务",
      "老人陪伴、用药/喝水提醒、跌倒巡检和异常通知",
      "夜间安全巡逻、门窗/燃气/宠物状态检查",
      "与智能门锁、灯光、空调、安防和家庭日历联动",
      "远程专家模式或云端辅助，用于处理超出自主能力的复杂任务",
      "任务日志、隐私授权、安全刹停、儿童/宠物避让和保险责任机制"
    ],
    "pricing": [
      "1X 官方 NEO 页面披露早期接入可选择 20000 美元购买或 499 美元/月订阅，并计划 2026 年在美国交付早期订单 [S1]。",
      "Unitree 官方商店显示人形机器人硬件从 4900 美元起到 100000 美元级别不等，但这些型号更多面向开发、展示、科研或行业场景 [S4]。",
      "国内媒体和行业分析普遍认为，真正进入家庭需要把整机价格从数十万元级继续压到约 10 万元人民币或更低，并建立售后、保险和安全标准 [S10]。",
      "家庭服务机器人也可能采用硬件销售 + 订阅、RaaS 租赁、远程专家服务、家政/养老机构共创和保险售后打包模式。"
    ],
    "business_model": "硬件销售或租赁 + 月度订阅/RaaS + 远程专家服务 + 家庭安全/养老服务包 + 维保保险 + 与家政、养老、地产和智能家居生态合作。",
    "target_users": [
      "高净值尝鲜家庭和科技爱好者",
      "双职工育儿家庭",
      "独居或半自理老人家庭及其子女",
      "已有保姆、护工或家庭管家支出的高端家庭",
      "家政、养老和高端物业机构的共创试点客户"
    ],
    "usage_scenarios": [
      "下班后整理客厅、递送物品和处理低风险跑腿任务",
      "老人独居场景的陪伴、提醒、巡检和异常通知",
      "夜间家庭安全巡逻与智能设备联动",
      "家政人员到场前后的辅助整理、清单核对和远程协助",
      "高端住宅、养老机构或展示空间的服务机器人试点"
    ],
    "assumptions": [
      "本报告把“人形家用机器人”定义为可进入真实家庭环境的服务机器人，不把工厂搬运、科研竞赛和舞台展示作为主要需求证据。",
      "没有单一品牌输入时，评分以品类需求成立度为对象，而不是评价某一家公司的技术实力。",
      "公开资料中家庭部署数据有限，因此用户口碑和真实留存仍是最弱证据层。"
    ]
  },
  "segments": [
    {
      "name": "高端尝鲜家庭",
      "scenario": "已购买高端智能家居、扫地机、安防设备和新能源车，愿意为前沿科技体验付费。",
      "job_to_be_done": "让家里拥有一个可展示、可体验、能做少量实事的未来家庭助手。",
      "current_alternatives": [
        "智能音箱和全屋智能",
        "扫地/洗地/割草机器人",
        "家政服务",
        "不买，继续观望"
      ],
      "buying_role": "家庭中的科技决策者和付款人主导，其他成员决定是否允许入户。",
      "adoption_blockers": [
        "价格与实际任务价值不匹配",
        "远程操作和摄像头入户带来的隐私担忧",
        "儿童、宠物和老人场景下的安全责任",
        "售后维护和占用空间"
      ]
    },
    {
      "name": "双职工育儿家庭",
      "scenario": "工作日时间紧张，希望降低打扫、收纳、照看孩子和家庭提醒的负担。",
      "job_to_be_done": "减少碎片化家务和提醒任务，让父母下班后少花时间处理琐事。",
      "current_alternatives": [
        "钟点工和保姆",
        "扫地机、洗地机、洗碗机、烘干机",
        "家庭成员分工",
        "儿童看护设备"
      ],
      "buying_role": "夫妻共同决策，安全和价格通常是一票否决项。",
      "adoption_blockers": [
        "不能替代真正育儿和复杂家务",
        "儿童安全风险",
        "学习和设置成本",
        "家庭隐私和噪音"
      ]
    },
    {
      "name": "独居或半自理老人家庭",
      "scenario": "老人需要陪伴、提醒、巡检和简单协助，子女希望远程确认状态。",
      "job_to_be_done": "在不长期雇佣护工的情况下，提高老人居家安全感和子女的可知情程度。",
      "current_alternatives": [
        "护工和保姆",
        "智能摄像头、呼叫器和穿戴设备",
        "社区养老服务",
        "养老机构"
      ],
      "buying_role": "子女付款和配置，老人决定是否愿意长期共处。",
      "adoption_blockers": [
        "老人对机器人形态和操作的接受度",
        "跌倒、服药和突发事件责任边界",
        "隐私和远程监控授权",
        "维护、上门服务和设备故障应急"
      ]
    },
    {
      "name": "高净值家庭/家庭管家替代",
      "scenario": "已有长期家政或管家支出，希望机器人承担夜间巡检、简单服务和可展示任务。",
      "job_to_be_done": "把一部分可标准化服务交给机器人，同时提升家庭科技形象和服务连续性。",
      "current_alternatives": [
        "全职保姆/管家",
        "物业管家",
        "智能家居中控",
        "安防服务"
      ],
      "buying_role": "家庭资产拥有者或管家团队决策，维护团队参与使用。",
      "adoption_blockers": [
        "机器人不能处理复杂非标服务",
        "昂贵设备与人工成本的替代账算不清",
        "高端家庭对隐私泄露零容忍",
        "售后响应必须接近家电/汽车级"
      ]
    },
    {
      "name": "家政/养老机构共创客户",
      "scenario": "机构希望通过机器人降低人力压力、展示科技能力，并积累可复制服务流程。",
      "job_to_be_done": "先在半结构化环境中验证任务库、成本模型和服务责任，再逐步复制到家庭。",
      "current_alternatives": [
        "服务机器人",
        "呼叫系统和摄像巡检",
        "护工排班系统",
        "人工培训和标准化流程"
      ],
      "buying_role": "机构经营者、运营负责人和安全责任人共同决策。",
      "adoption_blockers": [
        "采购预算和 ROI",
        "责任事故和保险",
        "员工协同成本",
        "技术展示与真实效率之间的落差"
      ]
    }
  ],
  "competitors": [
    {
      "name": "1X NEO",
      "type": "direct",
      "positioning": "面向家庭的 NEO Home Robot，官方披露购买或订阅方案，并使用 Redwood AI 与 Expert Mode 处理部分复杂任务。",
      "strengths": [
        "明确面向家庭场景",
        "有官方定价和早期交付计划",
        "远程专家模式可能补足早期自主能力"
      ],
      "weaknesses": [
        "价格和订阅成本很高",
        "远程操作引发隐私和信任问题",
        "早期自主能力边界仍需验证"
      ],
      "source_ids": [
        "S1",
        "S2",
        "S12",
        "S13"
      ]
    },
    {
      "name": "Figure 03",
      "type": "direct",
      "positioning": "Figure 官方强调面向日常场景和家庭环境的通用人形机器人。",
      "strengths": [
        "品牌和融资关注度高",
        "主张 Helix 能理解家庭环境和处理家务任务",
        "硬件形态更接近通用家用机器人想象"
      ],
      "weaknesses": [
        "尚未形成普通家庭可购买产品",
        "媒体测试和披露显示家庭应用仍处于早期",
        "真实家庭数据和任务可靠性不足"
      ],
      "source_ids": [
        "S3",
        "S11"
      ]
    },
    {
      "name": "Unitree 人形机器人",
      "type": "indirect",
      "positioning": "以开发者、科研、展示和行业客户为主的人形机器人硬件平台，价格覆盖较广。",
      "strengths": [
        "硬件价格区间下降速度快",
        "国内供应链和开发者生态强",
        "对行业教育和能力边界有示范价值"
      ],
      "weaknesses": [
        "不是完整家用服务产品",
        "家庭任务、售后、隐私和安全包装不足",
        "消费者购买理由不如行业客户清晰"
      ],
      "source_ids": [
        "S4"
      ]
    },
    {
      "name": "扫地机、洗地机和智能家居",
      "type": "substitute",
      "positioning": "针对单一家庭任务的成熟机器人和智能设备组合。",
      "strengths": [
        "价格低、效果明确",
        "隐私和安全风险小",
        "已被家庭广泛接受"
      ],
      "weaknesses": [
        "不能处理跨房间、多步骤和非结构化家务",
        "陪伴和照护能力有限"
      ],
      "source_ids": [
        "S5",
        "S6"
      ]
    },
    {
      "name": "人类家政和护工",
      "type": "manual",
      "positioning": "最直接满足家务和照护需求的人工服务。",
      "strengths": [
        "处理非标任务能力强",
        "情绪劳动和照护责任更成熟",
        "可按需购买服务时间"
      ],
      "weaknesses": [
        "服务质量不稳定",
        "长期成本高",
        "匹配、培训和信任成本持续存在"
      ],
      "source_ids": [
        "S9"
      ]
    },
    {
      "name": "不购买/继续等待",
      "type": "non_consumption",
      "positioning": "用户把人形家用机器人视为未来产品，但短期不承担价格、隐私和安全风险。",
      "strengths": [
        "零支出、零入户风险",
        "等待技术成熟和价格下降",
        "继续使用现有设备和人工服务"
      ],
      "weaknesses": [
        "无法获得早期自动化和陪伴体验",
        "不能解决家务和照护人力缺口"
      ],
      "source_ids": []
    }
  ],
  "triangle_analysis": {
    "lack": {
      "score": 6.65,
      "subscores": {
        "intensity": 7.0,
        "frequency": 8.0,
        "urgency": 5.0,
        "awareness": 7.0,
        "trend": 9.0,
        "willingness_to_pay": 5.0
      },
      "evidence": [
        "中国 60 岁及以上人口已超过 3.2 亿，老龄化与家庭照护压力构成长期需求底盘 [S7]。",
        "国内家政服务市场规模和从业人数庞大，且存在匹配、标准化和培训成本问题，说明家庭服务确实有持续痛点 [S9]。",
        "IFR 数据显示消费服务机器人接近 2000 万台年销量，家庭任务类占比极高，家庭自动化意愿已经被单任务机器人验证 [S5][S6]。",
        "政策层面明确把人形机器人视为战略产品，并提到未来拓展到医疗、家政、民生服务等场景 [S8]。"
      ],
      "counter_evidence": [
        "家庭并不一定缺“人形机器人”，很多家庭只缺更便宜可靠的扫地、收纳、照护提醒或家政服务。",
        "完整人形机器人属于高价、低频、强信任产品，用户紧迫性明显低于刚需家电和人工服务。",
        "IFR 同期数据显示 care-at-home 机器人登记销量很低，家庭照护型机器人并未被大规模购买验证 [S6]。"
      ],
      "reasoning": "缺乏感真实存在，但它首先指向家务和照护问题，而不是必然指向人形形态。老龄化、家政服务成本和家庭自动化趋势让长期需求有基础；短期弱点在于用户对“现在就买一台类人机器人进家”的迫切性和付费意愿不足。",
      "improvement_path": "把宏大的家用机器人愿景拆成高频、可量化、低风险的场景：老人夜间巡检、取物递送、用药提醒、异常通知、简单整理，并用真实家庭试点证明用户愿意为这些任务持续付费。"
    },
    "target_object": {
      "score": 5.63,
      "subscores": {
        "job_fit": 6.0,
        "clarity": 7.0,
        "differentiation": 7.0,
        "proof": 3.5,
        "category_fit": 5.0,
        "time_to_value": 4.0
      },
      "evidence": [
        "1X NEO 和 Figure 03 都把家庭、日常任务和家务协助作为公开叙事，说明目标物方向清晰 [S1][S2][S3]。",
        "人形形态相对单任务机器人有跨房间、使用人类工具、与家庭成员互动的差异化想象。",
        "Unitree 等平台把硬件价格和可获得性向下推进，但更多仍是开发和行业硬件，不等同于完整家庭产品 [S4]。"
      ],
      "counter_evidence": [
        "公开资料显示家庭场景下的完整自主能力仍不成熟，部分复杂任务需要远程专家或人工遥操作 [S1][S2][S11][S12]。",
        "单任务家电和人工家政在大多数家庭任务上更便宜、更确定、更容易被接受。",
        "“类人形态”带来展示价值，也带来机械安全、空间占用、恐惧感和隐私审查成本。"
      ],
      "reasoning": "目标物有强想象和一定产品雏形，但距离“家庭购买后稳定完成核心任务”还有明显证据缺口。它更像早期通用平台，而不是已经被充分证明的家用产品。当前最有机会的目标物不是“全能机器人”，而是“可监管的家庭任务执行终端”。",
      "improvement_path": "把目标物从全能管家重定位为可解释、可授权、可远程接管的家庭任务机器人；先证明 5 个任务的完成率、失败恢复、用户复用率和事故率，再扩展通用家务。"
    },
    "consumer_ability": {
      "score": 3.46,
      "subscores": {
        "money_cost": 2.5,
        "action_cost": 4.0,
        "learning_cost": 5.0,
        "trust_cost": 2.5,
        "risk_cost": 2.5,
        "image_cost": 6.0,
        "availability": 3.0
      },
      "evidence": [
        "1X NEO 官方披露的购买价和订阅价对普通家庭仍属高门槛 [S1]。",
        "行业观点认为人形机器人进入家庭还需要价格下降、安全稳定、标准、保险、维护和生态配套 [S10]。",
        "媒体对 NEO 的评论集中质疑远程操作和家庭数据隐私，这会显著推高信任成本 [S12][S13]。",
        "欧盟 AI Act 等风险监管框架显示，具备物理交互和安全影响的 AI 产品需要更严格的风险治理 [S14][S15]。"
      ],
      "counter_evidence": [
        "高端尝鲜家庭和机构客户能承受更高价格，并愿意为展示、陪伴或服务创新付费。",
        "订阅/RaaS、押金可退、保险和上门维保可降低一次性购买阻力。",
        "如果机器人只进入半结构化空间或限定任务，安全和隐私成本可以被局部压低。"
      ],
      "reasoning": "消费者能力是当前最大短板。即使需求愿望和产品叙事成立，家庭要把一个带摄像头、机械臂、可能远程接管的昂贵设备放进私密空间，需要同时跨过金钱、信任、安全、维护和责任边界。普通家庭短期很难承受这组成本。",
      "improvement_path": "不要先要求普通家庭购买整机；先用机构共创、押金试用、月租保险包、本地隐私模式、清晰遥操作授权和有限任务库降低能力成本。"
    }
  },
  "visual_diagnostics": [
    {
      "id": "score",
      "title": "总分诊断：愿望强，家庭购买能力不足",
      "chart_type": "score_gauge",
      "priority": 1,
      "data": {
        "score": 4.33,
        "label": "需求总分",
        "decision": "重定入口市场"
      },